{
  "schema_version": 1,
  "project_code": "TAEAN_FLOWER_2026",
  "source_document": "감정상태별 꽃 추천리스트.pdf",
  "recommendations": [
    {
      "id": "b713ba5d-6f72-59c3-ad90-3739949e017d",
      "display_order": 1,
      "emotion_code": "SERENITY",
      "emotion_name": {
        "ko": "평안함"
      },
      "stress_min": 0,
      "stress_max": 35,
      "flower_name": {
        "ko": "회양목"
      },
      "flower_meaning": {
        "ko": "참을성, 금욕"
      },
      "output_message": {
        "ko": "깊게 뿌리 내린 나무처럼 흔들림 없이 평온해요."
      },
      "match_rationale": {
        "ko": "흔들림 없는 상록수로 평온한 안정감과 일맥상통"
      },
      "active": true
    },
    {
      "id": "b2d6f0e5-e440-5da7-a3db-eacc36e4ba61",
      "display_order": 2,
      "emotion_code": "SERENITY",
      "emotion_name": {
        "ko": "평안함"
      },
      "stress_min": 0,
      "stress_max": 35,
      "flower_name": {
        "ko": "세덤"
      },
      "flower_meaning": {
        "ko": "고요한 사랑"
      },
      "output_message": {
        "ko": "깊게 뿌리 내린 나무처럼 흔들림 없이 평온해요."
      },
      "match_rationale": {
        "ko": "고요하고 차분한 꽃말이 평안함의 정서와 부합"
      },
      "active": true
    },
    {
      "id": "bca83c01-8272-5aca-a71c-48b20252c7cd",
      "display_order": 3,
      "emotion_code": "SERENITY",
      "emotion_name": {
        "ko": "평안함"
      },
      "stress_min": 0,
      "stress_max": 35,
      "flower_name": {
        "ko": "두메부추"
      },
      "flower_meaning": {
        "ko": "소박한 아름다움"
      },
      "output_message": {
        "ko": "깊게 뿌리 내린 나무처럼 흔들림 없이 평온해요."
      },
      "match_rationale": {
        "ko": "산지 자생의 소박한 아름다움이 내면의 평온과 어울림"
      },
      "active": true
    },
    {
      "id": "2518ae87-f749-5636-a316-f57c8d219ced",
      "display_order": 4,
      "emotion_code": "SERENITY",
      "emotion_name": {
        "ko": "평안함"
      },
      "stress_min": 0,
      "stress_max": 35,
      "flower_name": {
        "ko": "맥문동"
      },
      "flower_meaning": {
        "ko": "인내, 겸허"
      },
      "output_message": {
        "ko": "깊게 뿌리 내린 나무처럼 흔들림 없이 평온해요."
      },
      "match_rationale": {
        "ko": "사계절 푸른 인내의 식물로 깊은 평안함을 상징"
      },
      "active": true
    },
    {
      "id": "2e475f0b-9558-507b-acdc-3bfa25e29329",
      "display_order": 5,
      "emotion_code": "SERENITY",
      "emotion_name": {
        "ko": "평안함"
      },
      "stress_min": 0,
      "stress_max": 35,
      "flower_name": {
        "ko": "밀사초"
      },
      "flower_meaning": {
        "ko": "소박한 아름다움"
      },
      "output_message": {
        "ko": "깊게 뿌리 내린 나무처럼 흔들림 없이 평온해요."
      },
      "match_rationale": {
        "ko": "바람에 자연스럽게 흔들리는 모습이 평온한 상태를 연상"
      },
      "active": true
    },
    {
      "id": "c7b90512-2574-5a39-8a13-9d10bb0636cd",
      "display_order": 6,
      "emotion_code": "SERENITY",
      "emotion_name": {
        "ko": "평안함"
      },
      "stress_min": 0,
      "stress_max": 35,
      "flower_name": {
        "ko": "소스랑남천"
      },
      "flower_meaning": {
        "ko": "축복, 행운"
      },
      "output_message": {
        "ko": "깊게 뿌리 내린 나무처럼 흔들림 없이 평온해요."
      },
      "match_rationale": {
        "ko": "사계절 변화하는 상록 관목으로 깊은 뿌리의 안정감 표현"
      },
      "active": true
    },
    {
      "id": "2ac450ae-0393-54d9-96d2-f234731089a4",
      "display_order": 7,
      "emotion_code": "SERENITY",
      "emotion_name": {
        "ko": "평안함"
      },
      "stress_min": 0,
      "stress_max": 35,
      "flower_name": {
        "ko": "아이스댄스"
      },
      "flower_meaning": {
        "ko": "은은한 매력"
      },
      "output_message": {
        "ko": "깊게 뿌리 내린 나무처럼 흔들림 없이 평온해요."
      },
      "match_rationale": {
        "ko": "은은하고 차분한 매력이 흔들림 없는 평온함과 조화"
      },
      "active": true
    },
    {
      "id": "1e687cae-dbe4-5cdb-8c1c-43d3b80d1eac",
      "display_order": 8,
      "emotion_code": "SERENITY",
      "emotion_name": {
        "ko": "평안함"
      },
      "stress_min": 0,
      "stress_max": 35,
      "flower_name": {
        "ko": "에메랄드그린"
      },
      "flower_meaning": {
        "ko": "변치 않는 우정"
      },
      "output_message": {
        "ko": "깊게 뿌리 내린 나무처럼 흔들림 없이 평온해요."
      },
      "match_rationale": {
        "ko": "사계절 변치 않는 초록빛이 항구적 평안함을 상징"
      },
      "active": true
    },
    {
      "id": "40e0e109-791d-5812-87f7-3eb622546703",
      "display_order": 9,
      "emotion_code": "STABILITY",
      "emotion_name": {
        "ko": "안정"
      },
      "stress_min": 0,
      "stress_max": 35,
      "flower_name": {
        "ko": "페츄니아"
      },
      "flower_meaning": {
        "ko": "당신과 함께라면 마음이 편합니다"
      },
      "output_message": {
        "ko": "따뜻한 햇볕 아래 있는 것처럼 마음이 포근하고 안정적이에 요."
      },
      "match_rationale": {
        "ko": "꽃말 자체가 마음의 편안함·안정감을 직접 표현"
      },
      "active": true
    },
    {
      "id": "0fb55ffd-eec4-56c5-b65e-9cfa201915da",
      "display_order": 10,
      "emotion_code": "STABILITY",
      "emotion_name": {
        "ko": "안정"
      },
      "stress_min": 0,
      "stress_max": 35,
      "flower_name": {
        "ko": "꽃잔디"
      },
      "flower_meaning": {
        "ko": "합의, 온화"
      },
      "output_message": {
        "ko": "따뜻한 햇볕 아래 있는 것처럼 마음이 포근하고 안정적이에 요."
      },
      "match_rationale": {
        "ko": "온화한 꽃말이 포근한 안정감과 직접적으로 연결"
      },
      "active": true
    },
    {
      "id": "9d06f9f9-3726-505b-89f7-b487628b2cb3",
      "display_order": 11,
      "emotion_code": "STABILITY",
      "emotion_name": {
        "ko": "안정"
      },
      "stress_min": 0,
      "stress_max": 35,
      "flower_name": {
        "ko": "벨라데이지"
      },
      "flower_meaning": {
        "ko": "평화, 순수한 아름다움"
      },
      "output_message": {
        "ko": "따뜻한 햇볕 아래 있는 것처럼 마음이 포근하고 안정적이에 요."
      },
      "match_rationale": {
        "ko": "평화로운 꽃말이 안정적 감정 상태와 부합"
      },
      "active": true
    },
    {
      "id": "53646033-05e9-54c8-b948-ff23527db227",
      "display_order": 12,
      "emotion_code": "STABILITY",
      "emotion_name": {
        "ko": "안정"
      },
      "stress_min": 0,
      "stress_max": 35,
      "flower_name": {
        "ko": "캐모마일"
      },
      "flower_meaning": {
        "ko": "역경 속의 힘, 인내"
      },
      "output_message": {
        "ko": "따뜻한 햇볕 아래 있는 것처럼 마음이 포근하고 안정적이에 요."
      },
      "match_rationale": {
        "ko": "마음을 차분하게 하는 대표 허브로 안정감 상징"
      },
      "active": true
    },
    {
      "id": "a5cd6d47-d3c8-5e83-98c6-6ea19bb42132",
      "display_order": 13,
      "emotion_code": "STABILITY",
      "emotion_name": {
        "ko": "안정"
      },
      "stress_min": 0,
      "stress_max": 35,
      "flower_name": {
        "ko": "라벤다"
      },
      "flower_meaning": {
        "ko": "나에게 대답하세요"
      },
      "output_message": {
        "ko": "따뜻한 햇볕 아래 있는 것처럼 마음이 포근하고 안정적이에 요."
      },
      "match_rationale": {
        "ko": "심신 안정 효과로 유명한 허브, 안정 감정과 직결"
      },
      "active": true
    },
    {
      "id": "42556631-e185-5ff8-9245-799bf0fa3e41",
      "display_order": 14,
      "emotion_code": "STABILITY",
      "emotion_name": {
        "ko": "안정"
      },
      "stress_min": 0,
      "stress_max": 35,
      "flower_name": {
        "ko": "알리섬"
      },
      "flower_meaning": {
        "ko": "뛰어난 아름다움"
      },
      "output_message": {
        "ko": "따뜻한 햇볕 아래 있는 것처럼 마음이 포근하고 안정적이에 요."
      },
      "match_rationale": {
        "ko": "달콤한 꿀향의 소박한 꽃이 포근한 안정감을 연상"
      },
      "active": true
    },
    {
      "id": "95e0563a-7c72-5f68-8f0a-791f40346812",
      "display_order": 15,
      "emotion_code": "STABILITY",
      "emotion_name": {
        "ko": "안정"
      },
      "stress_min": 0,
      "stress_max": 35,
      "flower_name": {
        "ko": "베들레헴"
      },
      "flower_meaning": {
        "ko": "순수, 화해"
      },
      "output_message": {
        "ko": "따뜻한 햇볕 아래 있는 것처럼 마음이 포근하고 안정적이에 요."
      },
      "match_rationale": {
        "ko": "순수하고 청초한 별 모양 꽃이 마음의 안정을 표현"
      },
      "active": true
    },
    {
      "id": "a5c76e91-588f-5db5-83ee-e184bd98ea4c",
      "display_order": 16,
      "emotion_code": "STABILITY",
      "emotion_name": {
        "ko": "안정"
      },
      "stress_min": 0,
      "stress_max": 35,
      "flower_name": {
        "ko": "잉글리시라벤더"
      },
      "flower_meaning": {
        "ko": "침묵, 기다림"
      },
      "output_message": {
        "ko": "따뜻한 햇볕 아래 있는 것처럼 마음이 포근하고 안정적이에 요."
      },
      "match_rationale": {
        "ko": "깊은 향의 라벤더로 고요한 안정감을 상징"
      },
      "active": true
    },
    {
      "id": "53f4ecce-ae34-53cd-9434-ea45e86a9156",
      "display_order": 17,
      "emotion_code": "RELAXED",
      "emotion_name": {
        "ko": "느긋함"
      },
      "stress_min": 0,
      "stress_max": 35,
      "flower_name": {
        "ko": "데이지"
      },
      "flower_meaning": {
        "ko": "순수, 희망"
      },
      "output_message": {
        "ko": "바람에 몸을 맡긴 풀잎처럼 여유롭고 편안한 상태에요."
      },
      "match_rationale": {
        "ko": "소박하고 밝은 꽃이 여유로운 편안함을 연상"
      },
      "active": true
    },
    {
      "id": "cecd1ebd-3266-5b1a-a3fe-b384dce84089",
      "display_order": 18,
      "emotion_code": "RELAXED",
      "emotion_name": {
        "ko": "느긋함"
      },
      "stress_min": 0,
      "stress_max": 35,
      "flower_name": {
        "ko": "애플민트"
      },
      "flower_meaning": {
        "ko": "미덕"
      },
      "output_message": {
        "ko": "바람에 몸을 맡긴 풀잎처럼 여유롭고 편안한 상태에요."
      },
      "match_rationale": {
        "ko": "상쾌한 사과 향이 여유로운 기분을 선사"
      },
      "active": true
    },
    {
      "id": "35b27463-e911-531c-ba5f-9b25db1913c7",
      "display_order": 19,
      "emotion_code": "RELAXED",
      "emotion_name": {
        "ko": "느긋함"
      },
      "stress_min": 0,
      "stress_max": 35,
      "flower_name": {
        "ko": "리빙스턴데이지"
      },
      "flower_meaning": {
        "ko": "나태, 게으름"
      },
      "output_message": {
        "ko": "바람에 몸을 맡긴 풀잎처럼 여유롭고 편안한 상태에요."
      },
      "match_rationale": {
        "ko": "꽃말이 느긋한 여유로움과 직접적으로 연결"
      },
      "active": true
    },
    {